### ISSUE TITLE
Postgre connection leak

### ISSUE THREAD

**Issue by rolen** [its-a-feature/Mythic#106]
Hey,

Have found an issue where the callbacks are not being shown within the UI.

If you look within the browser console see the following error message is displayed
`Error: websocket closed`

Looking then at the `mythic-docker/mythic_access.log` can see a number of the following messages 
`"level":"WARNING","message":"websocket_routes.py error: FATAL:  sorry, too many clients already\n"}`

Googling that text points to this Stackoverflow article about postgre library (albeit Java, ewww) returning the same error [https://stackoverflow.com/questions/2757549/org-postgresql-util-psqlexception-fatal-sorry-too-many-clients-already](url) 

Doing a ps aux | grep postgre can see over 390 processes such as the following 
`70       13555  0.0  0.1 208544 10676 ?        Ss   10:28   0:00 postgres: mythic_user mythic_db <ip>(49892) idle`

Have been restarting Docker but found that picking a random one and killing seemed to sort.
My sherlock-like powers of deduction suggest this maybe a DB connection leak.

Currently running on 
```
Ubuntu 18.04.5 LTS x64

Docker Engine - Community
Client: 
 Version:           20.10.7
Server:
  Version:          19.03.13
```

**Comment by rolen** [comment]
After killed one of the connections just found in the `mythic-docker/mythic_access.log` the following message

`"ERROR","message":"Exception in rabbit_pt_callback: 296 connection already closed"}`

Suggesting it may be something to do with Rabbit

**Comment by its-a-feature** [comment]
Which version of Mythic are you using?

**Comment by rolen** [comment]
Think it's v2.2.7, that's what it says in the GUI

**Comment by its-a-feature** [comment]
ah ok, we noticed that happening a while ago too and I have what _should_ be a fix in the 2.2.12 version. What I think the problem was:
The database allows for 400 connections. I allow the Mythic server to pool 400 connections. In the 2.2 updates, I added worker processes to the Mythic server so that we can leverage multiple CPUs; however, I messed up and _each_ worker thought it had a pool of 400 connections to leverage, instead of 400 across all workers. So, after enough time or enough agents, you'd run out of connections and get the error that you saw. That should be fixed in the 2.2.12 version though.

**Comment by jmpalk** [comment]
I'm having a similar issue with callbacks not appearing in the UI. I'm running Mythic 2.2.13 on Ubuntu 20 and testing with Medusa and Merlin payloads using http c2. I can see the callbacks and heartbeats if I use tcpdump to monitor network traffic, but nothing appears in the UI. I haven't yet identified any related error messages.

**Comment by its-a-feature** [comment]
@jmpalk , you created payloads and can see them reach out, but are not seeing them in the UI as callbacks right? Can you share your payload configuration (Operational Views -> Created Payloads -> find your payload and select View Config)? If you look on the Global Configurations -> C2 Profiles, can you make sure your c2 profile has the docker container running (green circle) and that the internal server is running? If so, can you also try to adjust the `http` configuration for `debug: true`, then use the dropdown to stop the internal server and start it again. This should then provide a lot more information about what's going on with any data the http profile receives. Kick off your agent again, wait a few seconds, then click to view the stdout/stderr for the profile. If you're not seeing anything, then that means that no traffic is making its way to your c2 profile

**Comment by jmpalk** [comment]
So, I've double-checked my C2 and payload configs (attached below) and everything seems like it should work. The docker container is running (shows green) and the internal server is running. After running a new agent on a test machine I don't get any stdout/stderr info back in the UI. But I'm seeing this in tcpdump:

```
jmpalk@mythic:/home/mythic/Mythic/mythic-docker$ sudo tcpdump -i eth0 port 443
tcpdump: verbose output suppressed, use -v or -vv for full protocol decode
listening on eth0, link-type EN10MB (Ethernet), capture size 262144 bytes
00:58:31.688159 IP linux-target.lan.60386 > mythic.lan.https: Flags [S], seq 875322234, win 64240, options [mss 1460,sackOK,TS val 4017793538 ecr 0,nop,wscale 7], length 0
00:58:31.688211 IP mythic.lan.https > linux-target.lan.60386: Flags [S.], seq 3942263508, ack 875322235, win 65160, options [mss 1460,sackOK,TS val 304017446 ecr 4017793538,nop,wscale 7], length 0
00:58:31.688308 IP linux-target.lan.60386 > mythic.lan.https: Flags [.], ack 1, win 502, options [nop,nop,TS val 4017793538 ecr 304017446], length 0
00:58:31.688541 IP linux-target.lan.60386 > mythic.lan.https: Flags [P.], seq 1:518, ack 1, win 502, options [nop,nop,TS val 4017793538 ecr 304017446], length 517
00:58:31.688549 IP mythic.lan.https > linux-target.lan.60386: Flags [.], ack 518, win 506, options [nop,nop,TS val 304017447 ecr 4017793538], length 0
00:58:31.696214 IP mythic.lan.https > linux-target.lan.60386: Flags [P.], seq 1:2289, ack 518, win 506, options [nop,nop,TS val 304017454 ecr 4017793538], length 2288
00:58:31.696381 IP linux-target.lan.60386 > mythic.lan.https: Flags [.], ack 2289, win 501, options [nop,nop,TS val 4017793546 ecr 304017454], length 0
00:58:31.696642 IP linux-target.lan.60386 > mythic.lan.https: Flags [P.], seq 518:525, ack 2289, win 501, options [nop,nop,TS val 4017793546 ecr 304017454], length 7
00:58:31.696652 IP mythic.lan.https > linux-target.lan.60386: Flags [.], ack 525, win 506, options [nop,nop,TS val 304017455 ecr 4017793546], length 0
00:58:31.696745 IP linux-target.lan.60386 > mythic.lan.https: Flags [R.], seq 525, ack 2289, win 501, options [nop,nop,TS val 4017793547 ecr 304017455], length 0
00:58:42.708772 IP linux-target.lan.60388 > mythic.lan.https: Flags [S], seq 668289440, win 64240, options [mss 1460,sackOK,TS val 4017804558 ecr 0,nop,wscale 7], length 0
00:58:42.708819 IP mythic.lan.https > linux-target.lan.60388: Flags [S.], seq 1341514903, ack 668289441, win 65160, options [mss 1460,sackOK,TS val 304028467 ecr 4017804558,nop,wscale 7], length 0
00:58:42.708909 IP linux-target.lan.60388 > mythic.lan.https: Flags [.], ack 1, win 502, options [nop,nop,TS val 4017804559 ecr 304028467], length 0
00:58:42.709084 IP linux-target.lan.60388 > mythic.lan.https: Flags [P.], seq 1:518, ack 1, win 502, options [nop,nop,TS val 4017804559 ecr 304028467], length 517
00:58:42.709092 IP mythic.lan.https > linux-target.lan.60388: Flags [.], ack 518, win 506, options [nop,nop,TS val 304028467 ecr 4017804559], length 0
00:58:42.714743 IP mythic.lan.https > linux-target.lan.60388: Flags [P.], seq 1:2289, ack 518, win 506, options [nop,nop,TS val 304028473 ecr 4017804559], length 2288
00:58:42.714855 IP linux-target.lan.60388 > mythic.lan.https: Flags [.], ack 2289, win 501, options [nop,nop,TS val 4017804565 ecr 304028473], length 0
00:58:42.715163 IP linux-target.lan.60388 > mythic.lan.https: Flags [P.], seq 518:525, ack 2289, win 501, options [nop,nop,TS val 4017804565 ecr 304028473], length 7
00:58:42.715186 IP mythic.lan.https > linux-target.lan.60388: Flags [.], ack 525, win 506, options [nop,nop,TS val 304028473 ecr 4017804565], length 0
00:58:42.715264 IP linux-target.lan.60388 > mythic.lan.https: Flags [R.], seq 525, ack 2289, win 501, options [nop,nop,TS val 4017804565 ecr 304028473], length 0
00:58:42.715318 IP linux-target.lan.60388 > mythic.lan.https: Flags [R], seq 668289965, win 0, length 0
```

C2 config:
```
{
  "instances": [
  {
    "ServerHeaders": {
      "Server": "NetDNA-cache/2.2",
      "Cache-Control": "max-age=0, no-cache",
      "Pragma": "no-cache",
      "Connection": "keep-alive",
      "Content-Type": "application/javascript; charset=utf-8"
    },
    "port": 443,
    "key_path": "privkey.pem",
    "cert_path": "fullchain.pem",
    "debug": true,
    "use_ssl": true
    }
  ]
}
```

Payload config
```
{
    "payload_type": "medusa",
    "c2_profiles": [
        {
            "c2_profile": "http",
            "c2_profile_parameters": {
                "AESPSK": "aes256_hmac",
                "headers": [
                    {
                        "name": "User-Agent",
                        "key": "User-Agent",
                        "value": "Mozilla/5.0 (Windows NT 6.3; Trident/7.0; rv:11.0) like Gecko",
                        "custom": false
                    }
                ],
                "callback_jitter": "23",
                "encrypted_exchange_check": "T",
                "killdate": "2022-08-17",
                "callback_port": "443",
                "callback_interval": "10",
                "proxy_pass": "",
                "proxy_user": "",
                "proxy_port": "",
                "proxy_host": "",
                "query_path_name": "q",
                "post_uri": "data",
                "get_uri": "index",
                "callback_host": "https://192.168.1.217"
            }
        }
    ],
    "commands": [
        "cwd",
        "cd",
        "shell",
        "exit",
        "cp",
        "ls"
    ],
    "selected_os": "Linux",
    "tag": "Created by thekilt at 08/17/2021 00:56:57 UTC",
    "wrapper": false,
    "build_parameters": [
        {
            "id": 36,
            "build_parameter": {
                "id": 1,
                "name": "output",
                "parameter_type": "ChooseOne",
                "description": "Choose output format",
                "payload_type": "medusa",
                "required": true,
                "verifier_regex": "",
                "deleted": false,
                "parameter": "py\nbase64"
            },
            "payload": "59e57941-da22-4f02-ae47-92afa9d6d2fe",
            "parameter": "py",
            "name": "output",
            "value": "py"
        },
        {
            "id": 37,
            "build_parameter": {
                "id": 2,
                "name": "python_version",
                "parameter_type": "ChooseOne",
                "description": "Choose Python version",
                "payload_type": "medusa",
                "required": true,
                "verifier_regex": "",
                "deleted": false,
                "parameter": "Python 3.8\nPython 2.7"
            },
            "payload": "59e57941-da22-4f02-ae47-92afa9d6d2fe",
            "parameter": "Python 3.8",
            "name": "python_version",
            "value": "Python 3.8"
        },
        {
            "id": 38,
            "build_parameter": {
                "id": 3,
                "name": "use_non_default_cryptography_lib",
                "parameter_type": "ChooseOne",
                "description": "Use non-default 'cryptography' Python library for comms (if not, manual crypto will be used)",
                "payload_type": "medusa",
                "required": true,
                "verifier_regex": "",
                "deleted": false,
                "parameter": "No\nYes"
            },
            "payload": "59e57941-da22-4f02-ae47-92afa9d6d2fe",
            "parameter": "Yes",
            "name": "use_non_default_cryptography_lib",
            "value": "Yes"
        },
        {
            "id": 39,
            "build_parameter": {
                "id": 4,
                "name": "obfuscate_script",
                "parameter_type": "ChooseOne",
                "description": "XOR and Base64-encode agent code",
                "payload_type": "medusa",
                "required": true,
                "verifier_regex": "",
                "deleted": false,
                "parameter": "Yes\nNo"
            },
            "payload": "59e57941-da22-4f02-ae47-92afa9d6d2fe",
            "parameter": "Yes",
            "name": "obfuscate_script",
            "value": "Yes"
        }
    ],
    "filename": "medusa.py"
}
```

**Comment by its-a-feature** [comment]
from the box where your agent is running, are you able to hit your c2 profile with curl or anything else? You should be able to even just do a simple GET request to "https://192.168.1.217" and see an error message pop up in the Mythic UI.

**Comment by jmpalk** [comment]
OK, curl worked, and also suddenly merlin agents are working. Something's apparently screwy with my medusa agents. I'll do more troubleshooting of that on my own. Thanks for the help!

**Comment by rolen** [comment]
Ahh please don't close it, I'm still getting the connection leak and having to restart docker every couple of days (although thankfully I'm coming to the end of the engagement.)

**Comment by its-a-feature** [comment]
You're on version 2.2.7 though right?

**Comment by rolen** [comment]
Guilty as charged, seemed to have missed a release, cool I'll update once job is complete and before I tear all the inf down I'll update and see what happens

**Comment by its-a-feature** [comment]
In the meantime, what you can do is make the change manually yourself (it's just a small change):
This is the old:
https://github.com/its-a-feature/Mythic/blob/1da23cea414071e122c9a980b3a0c004e2b5e580/mythic-docker/app/routes/routes.py#L372-L373
This is the new:
https://github.com/its-a-feature/Mythic/blob/master/mythic-docker/app/routes/routes.py#L371-L375
with that whole function wrapped in a try except block

**Comment by rolen** [comment]
Awesome thanks, I'll give that a shot

**Comment by its-a-feature** [comment]
With the new v3.0.0 version coming out in a few weeks I'm going to close this issue as it involved a completely different back-end system (switch from Python to GoLang). If you still encounter this issue with the new v3.0.0 code, we can re-open it
